[
  {
    "id": "018f5a00-0000-7000-8000-000000000301",
    "tenant_id": "eko",
    "dc_user_id": "018f5a00-0000-7000-8000-000000000201",
    "plan_date": "2026-01-01",
    "version": 1,
    "stops": [
      {
        "id": "018f5a00-0000-7000-8000-000000000311",
        "seq": 1,
        "location_id": "018f5a00-0000-7000-8000-000000000105",
        "visit_type": "CSP_AUDIT"
      },
      {
        "id": "018f5a00-0000-7000-8000-000000000312",
        "seq": 2,
        "location_id": "018f5a00-0000-7000-8000-000000000106",
        "visit_type": "CSP_FOLLOWUP"
      },
      {
        "id": "018f5a00-0000-7000-8000-000000000313",
        "seq": 3,
        "location_id": "018f5a00-0000-7000-8000-000000000109",
        "visit_type": "CSP_AUDIT"
      }
    ],
    "updated_at": "2026-01-01T00:00:00Z"
  }
]
